{"candidate_link_count":296,"canonical_identity_status":"unverified","canonical_link_count":76,"collectible_record_count":1758,"cross_type_conflict_cluster_count":16,"cross_type_conflict_collectible_cluster_count":11,"cross_type_conflict_collectible_record_count":26,"excluded_non_collectible_count":1508,"identity_scope":"source_snapshot_only","link_status_counts":{"candidate_link":296,"canonical_link":76,"unresolved":1386},"model_feature_status":"excluded_pending_verification","notes":"Each row is a source-scoped observation from one pinned snapshot, not a canonical item identity. Links are review evidence only; conflicts are quarantined and all rows are excluded from model features.","promotion_eligibility":"prohibited","snapshot_id":"vendor_skygame_data_1_3_4","source_id":"source_skygame_data_1_3_4","source_snapshot_sha256":"21CCAD77006C425B27EE9314870BB5BB77E8436459C6DA214ABCB2B0D8329BBB","unresolved_count":1386,"vendor_item_count":3266}
